{
  "version": 1,
  "request_id": "xray-linux64-v26.3.27-20260815",
  "sources": [
    {
      "type": "url",
      "url": "https://github.com/XTLS/Xray-core/releases/download/v26.3.27/Xray-linux-64.zip",
      "destination": "downloads/Xray-linux-64.zip",
      "sha256": "23cd9af937744d97776ee35ecad4972cf4b2109d1e0fe6be9930467608f7c8ae"
    }
  ],
  "python": {"enabled": false, "requirements": [], "requirements_files": [], "only_binary": true},
  "node": {"enabled": false, "manager": "pnpm"},
  "artifact": {"part_size_mb": 50}
}
