{
  "version": 1,
  "request_id": "mysql-8046-debian13-amd64",
  "sources": [
    {
      "type": "url",
      "url": "https://cdn.mysql.com/Downloads/MySQL-8.0/mysql-8.0.46-linux-glibc2.17-x86_64-minimal.tar.xz",
      "destination": "downloads/mysql-8.0.46-linux-glibc2.17-x86_64-minimal.tar.xz"
    },
    {
      "type": "url",
      "url": "https://deb.debian.org/debian/pool/main/liba/libaio/libaio1t64_0.3.113-8+b1_amd64.deb",
      "destination": "downloads/libaio1t64_0.3.113-8+b1_amd64.deb",
      "sha256": "490c8a2d116001a5f3b0a6d7a7aabf6a7b629366590dc5c3f75b078e931dd129"
    }
  ],
  "python": {
    "enabled": false,
    "requirements": [],
    "requirements_files": [],
    "only_binary": true
  },
  "node": {
    "enabled": false,
    "manager": "pnpm"
  },
  "artifact": {
    "part_size_mb": 100
  }
}
